{
  "$schema": "https://json-schema.org/draft/2020-12/schema",
  "$id": "runtime/schemas/user-profile.schema.json",
  "title": "UserProfile",
  "type": "object",
  "required": ["userId", "displayName", "persona", "dailyAgentId", "workspaceId", "capabilityProfile", "status"],
  "properties": {
    "userId": { "type": "string", "minLength": 1 },
    "displayName": { "type": "string", "minLength": 1 },
    "persona": {
      "type": "object",
      "required": ["style", "boundaries"],
      "properties": {
        "style": { "type": "string" },
        "boundaries": { "type": "array", "items": { "type": "string" } },
        "customNotes": { "type": "array", "items": { "type": "string" } }
      },
      "additionalProperties": false
    },
    "dailyAgentId": { "type": "string", "pattern": "^daily-[A-Za-z0-9_.-]+$" },
    "workspaceId": { "type": "string", "pattern": "^workspace-daily-[A-Za-z0-9_.-]+$" },
    "capabilityProfile": { "type": "string", "enum": ["daily_light"] },
    "bindings": {
      "type": "object",
      "properties": {
        "accountIds": { "type": "array", "items": { "type": "string" } },
        "channelIds": { "type": "array", "items": { "type": "string" } }
      },
      "additionalProperties": false
    },
    "preferences": { "type": "object", "additionalProperties": true },
    "status": { "type": "string", "enum": ["active", "disabled", "archived", "pending_review"] },
    "createdAt": { "type": "string", "format": "date-time" },
    "updatedAt": { "type": "string", "format": "date-time" }
  },
  "additionalProperties": false
}
